{
  "$schema": "https://json-schema.org/draft/2020-12/schema",
  "$id": "https://raw.githubusercontent.com/daflan-org/fawa-compliance-evidence/main/schemas/evidence.schema.json",
  "title": "ComplianceEvidence",
  "type": "object",
  "additionalProperties": false,
  "required": [
    "schemaVersion",
    "generatedAt",
    "source",
    "policyStatus",
    "attestationStatus",
    "documents",
    "testEvidence",
    "verificationCommands",
    "limits"
  ],
  "properties": {
    "schemaVersion": { "const": "1.0.0" },
    "generatedAt": { "type": "string", "format": "date-time" },
    "source": {
      "type": "object",
      "additionalProperties": false,
      "required": ["owner", "repo", "ref", "commitSha"],
      "properties": {
        "owner": { "type": "string", "minLength": 1 },
        "repo": { "type": "string", "minLength": 1 },
        "ref": { "type": "string", "minLength": 1 },
        "commitSha": { "type": "string", "minLength": 7 }
      }
    },
    "policyStatus": {
      "type": "object",
      "additionalProperties": false,
      "required": [
        "provider",
        "workflowPath",
        "policyPath",
        "inputBuilderPath"
      ],
      "properties": {
        "provider": { "type": "string", "minLength": 1 },
        "workflowPath": { "type": "string", "minLength": 1 },
        "policyPath": { "type": "string", "minLength": 1 },
        "inputBuilderPath": { "type": "string", "minLength": 1 }
      }
    },
    "attestationStatus": {
      "type": "object",
      "additionalProperties": false,
      "required": ["provider", "workflowPaths"],
      "properties": {
        "provider": { "type": "string", "minLength": 1 },
        "workflowPaths": {
          "type": "array",
          "items": { "type": "string", "minLength": 1 },
          "minItems": 1
        }
      }
    },
    "documents": {
      "type": "array",
      "minItems": 2,
      "items": {
        "type": "object",
        "additionalProperties": false,
        "required": ["key", "title", "path", "url", "sha"],
        "properties": {
          "key": {
            "type": "string",
            "enum": ["trustCompliance", "storeCompliance"]
          },
          "title": { "type": "string", "minLength": 1 },
          "path": { "type": "string", "minLength": 1 },
          "url": { "type": "string", "minLength": 1 },
          "sha": { "type": "string", "minLength": 1 }
        }
      }
    },
    "testEvidence": {
      "type": "array",
      "items": {
        "type": "object",
        "additionalProperties": false,
        "required": [
          "testId",
          "sourcePath",
          "suiteType",
          "result",
          "workflowPath",
          "runId",
          "jobName",
          "sourceCommitSha",
          "executedAt",
          "artifacts",
          "verificationCommand"
        ],
        "properties": {
          "testId": { "type": "string", "minLength": 1 },
          "sourcePath": { "type": "string", "minLength": 1 },
          "suiteType": { "type": "string", "enum": ["unit", "e2e"] },
          "result": { "type": "string", "enum": ["passed", "failed"] },
          "workflowPath": { "type": "string", "minLength": 1 },
          "runId": { "type": "string", "minLength": 1 },
          "jobName": { "type": "string", "minLength": 1 },
          "sourceCommitSha": { "type": "string", "minLength": 7 },
          "executedAt": { "type": "string", "format": "date-time" },
          "artifacts": {
            "type": "array",
            "minItems": 1,
            "items": {
              "type": "object",
              "additionalProperties": false,
              "required": ["format", "path", "sha256"],
              "properties": {
                "format": { "type": "string", "enum": ["json", "junit"] },
                "path": { "type": "string", "minLength": 1 },
                "sha256": {
                  "type": "string",
                  "pattern": "^[A-Fa-f0-9]{64}$"
                }
              }
            }
          },
          "verificationCommand": { "type": "string", "minLength": 1 }
        }
      }
    },
    "verificationCommands": {
      "type": "array",
      "items": {
        "type": "object",
        "additionalProperties": false,
        "required": ["label", "command"],
        "properties": {
          "label": { "type": "string", "minLength": 1 },
          "command": { "type": "string", "minLength": 1 }
        }
      }
    },
    "limits": {
      "type": "array",
      "items": { "type": "string", "minLength": 1 }
    }
  }
}
