{
  "schemaVersion": "1.0.0",
  "generatedAt": "2026-03-01T00:12:14.369Z",
  "source": {
    "owner": "panalgin",
    "repo": "falcon",
    "ref": "pre-prod",
    "commitSha": "47638331e37032337ad98071de17493c2165b2e5"
  },
  "policyStatus": {
    "provider": "OPA + Conftest",
    "workflowPath": ".github/workflows/ci-tests.yml",
    "policyPath": "policy/repo/ci.rego",
    "inputBuilderPath": "scripts/policy/build-policy-input.ts"
  },
  "attestationStatus": {
    "provider": "Sigstore Cosign",
    "workflowPaths": [
      ".github/workflows/deploy-preprod.yml",
      ".github/workflows/deploy-prod.yml",
      ".github/workflows/deploy-worker-preprod.yml",
      ".github/workflows/deploy-worker-prod.yml"
    ]
  },
  "documents": [
    {
      "key": "trustCompliance",
      "title": "Trust And Compliance Evidence",
      "path": "current/trust-evidence.md",
      "url": "https://raw.githubusercontent.com/daflan-org/fawa-compliance-evidence/main/current/trust-evidence.md",
      "sha": "017c5935e47b2e7ea912efd30c1ec330b0cb9547"
    },
    {
      "key": "storeCompliance",
      "title": "Store Compliance Backend Evidence DAF-418",
      "path": "current/store-compliance.md",
      "url": "https://raw.githubusercontent.com/daflan-org/fawa-compliance-evidence/main/current/store-compliance.md",
      "sha": "e93451ba6b356051e75bd506af43512b1cbd4bcc"
    }
  ],
  "testEvidence": [
    {
      "testId": "permission-analyzer-unit",
      "sourcePath": "packages/domain/src/device/services/permission-analyzer.service.spec.ts",
      "suiteType": "unit",
      "result": "passed",
      "workflowPath": ".github/workflows/ci-tests.yml",
      "runId": "22531813395",
      "jobName": "Unit Tests",
      "sourceCommitSha": "47638331e37032337ad98071de17493c2165b2e5",
      "executedAt": "2026-03-01T00:04:20.725Z",
      "artifacts": [
        {
          "format": "json",
          "path": "current/tests/permission-analyzer-unit.json",
          "sha256": "61efc636db5a0ae938cc885b0c3c19a20cb1468783d46dd6212fd5c4a45fe3e9"
        },
        {
          "format": "junit",
          "path": "current/tests/permission-analyzer-unit.junit.xml",
          "sha256": "fc2e8cd293404887175d63f850830cb0c3e878ecb2e63a51d28d39cf6744f227"
        }
      ],
      "verificationCommand": "curl -fsSL \"https://raw.githubusercontent.com/daflan-org/fawa-compliance-evidence/main/current/tests/permission-analyzer-unit.json\" -o /tmp/permission-analyzer-unit.json && echo \"61efc636db5a0ae938cc885b0c3c19a20cb1468783d46dd6212fd5c4a45fe3e9  /tmp/permission-analyzer-unit.json\" | shasum -a 256 -c -"
    },
    {
      "testId": "ttl-indexes-persistence-unit",
      "sourcePath": "packages/persistence/src/mongoose/ttl-indexes.spec.ts",
      "suiteType": "unit",
      "result": "passed",
      "workflowPath": ".github/workflows/ci-tests.yml",
      "runId": "22531813395",
      "jobName": "Unit Tests",
      "sourceCommitSha": "47638331e37032337ad98071de17493c2165b2e5",
      "executedAt": "2026-03-01T00:04:20.726Z",
      "artifacts": [
        {
          "format": "json",
          "path": "current/tests/ttl-indexes-persistence-unit.json",
          "sha256": "559f4b8aa560522ffa4802c05ef905e7c84dc7f18a2913b08c14c31c4b5a834f"
        },
        {
          "format": "junit",
          "path": "current/tests/ttl-indexes-persistence-unit.junit.xml",
          "sha256": "c76957fff16838637b701b938bf6bffa05f03b8002e1dd8f6f63eeb67cec9c5e"
        }
      ],
      "verificationCommand": "curl -fsSL \"https://raw.githubusercontent.com/daflan-org/fawa-compliance-evidence/main/current/tests/ttl-indexes-persistence-unit.json\" -o /tmp/ttl-indexes-persistence-unit.json && echo \"559f4b8aa560522ffa4802c05ef905e7c84dc7f18a2913b08c14c31c4b5a834f  /tmp/ttl-indexes-persistence-unit.json\" | shasum -a 256 -c -"
    },
    {
      "testId": "ttl-indexes-api-unit",
      "sourcePath": "apps/api/src/schemas/ttl-indexes.spec.ts",
      "suiteType": "unit",
      "result": "passed",
      "workflowPath": ".github/workflows/ci-tests.yml",
      "runId": "22531813395",
      "jobName": "Unit Tests",
      "sourceCommitSha": "47638331e37032337ad98071de17493c2165b2e5",
      "executedAt": "2026-03-01T00:04:20.726Z",
      "artifacts": [
        {
          "format": "json",
          "path": "current/tests/ttl-indexes-api-unit.json",
          "sha256": "b3a991c678fcbd4bfc52f45f39ad54f5288a4aaa075fee5a8c6a73dc642a2f16"
        },
        {
          "format": "junit",
          "path": "current/tests/ttl-indexes-api-unit.junit.xml",
          "sha256": "1f0c9cd964582859ec2800825c222e167d52a328de0e57888f3b83a1442de358"
        }
      ],
      "verificationCommand": "curl -fsSL \"https://raw.githubusercontent.com/daflan-org/fawa-compliance-evidence/main/current/tests/ttl-indexes-api-unit.json\" -o /tmp/ttl-indexes-api-unit.json && echo \"b3a991c678fcbd4bfc52f45f39ad54f5288a4aaa075fee5a8c6a73dc642a2f16  /tmp/ttl-indexes-api-unit.json\" | shasum -a 256 -c -"
    },
    {
      "testId": "device-sync-e2e",
      "sourcePath": "apps/api/test/device-sync.e2e.spec.ts",
      "suiteType": "e2e",
      "result": "passed",
      "workflowPath": ".github/workflows/ci-tests.yml",
      "runId": "22531813395",
      "jobName": "Integration And E2E Tests",
      "sourceCommitSha": "47638331e37032337ad98071de17493c2165b2e5",
      "executedAt": "2026-03-01T00:04:22.050Z",
      "artifacts": [
        {
          "format": "json",
          "path": "current/tests/device-sync-e2e.json",
          "sha256": "9eb7036e6b8e8117167f66359aa5ee7dad78a979f0b45bb3e87af7cdce77453c"
        },
        {
          "format": "junit",
          "path": "current/tests/device-sync-e2e.junit.xml",
          "sha256": "8ce690ba2847c4c341e17b751118c1d86a03ec7e5427a762a8a73b53f12048d2"
        }
      ],
      "verificationCommand": "curl -fsSL \"https://raw.githubusercontent.com/daflan-org/fawa-compliance-evidence/main/current/tests/device-sync-e2e.json\" -o /tmp/device-sync-e2e.json && echo \"9eb7036e6b8e8117167f66359aa5ee7dad78a979f0b45bb3e87af7cdce77453c  /tmp/device-sync-e2e.json\" | shasum -a 256 -c -"
    },
    {
      "testId": "sos-e2e",
      "sourcePath": "apps/api/test/sos.e2e.spec.ts",
      "suiteType": "e2e",
      "result": "passed",
      "workflowPath": ".github/workflows/ci-tests.yml",
      "runId": "22531813395",
      "jobName": "Integration And E2E Tests",
      "sourceCommitSha": "47638331e37032337ad98071de17493c2165b2e5",
      "executedAt": "2026-03-01T00:04:22.052Z",
      "artifacts": [
        {
          "format": "json",
          "path": "current/tests/sos-e2e.json",
          "sha256": "de3c9e42528bdf504bf104a488ab01db675ccc92ae20523eb6774d2ce9633e30"
        },
        {
          "format": "junit",
          "path": "current/tests/sos-e2e.junit.xml",
          "sha256": "0115b496e15c238abb67f04ed59770f114ba5ec636ecd116b959fea930c3969b"
        }
      ],
      "verificationCommand": "curl -fsSL \"https://raw.githubusercontent.com/daflan-org/fawa-compliance-evidence/main/current/tests/sos-e2e.json\" -o /tmp/sos-e2e.json && echo \"de3c9e42528bdf504bf104a488ab01db675ccc92ae20523eb6774d2ce9633e30  /tmp/sos-e2e.json\" | shasum -a 256 -c -"
    }
  ],
  "verificationCommands": [
    {
      "label": "Verify container signature",
      "command": "cosign verify ghcr.io/<org>/<image>@sha256:<digest> --certificate-identity-regexp \"https://github.com/<org>/falcon/.github/workflows/.*\" --certificate-oidc-issuer \"https://token.actions.githubusercontent.com\""
    },
    {
      "label": "Verify container attestation",
      "command": "cosign verify-attestation ghcr.io/<org>/<image>@sha256:<digest> --certificate-identity-regexp \"https://github.com/<org>/falcon/.github/workflows/.*\" --certificate-oidc-issuer \"https://token.actions.githubusercontent.com\""
    },
    {
      "label": "Run local policy checks",
      "command": "CHANGED_FILES_JSON='[\"packages/socket-contracts/src/app-events.ts\"]' GITHUB_REF_NAME='daf-418-store-compliance-backend-evidence-for-daf-307' GITHUB_EVENT_NAME='pull_request' yarn policy:build-input && conftest test policy-input.json -p policy/repo"
    }
  ],
  "limits": [
    "Evidence summary only includes verification metadata and source links.",
    "Operational secrets and sensitive runtime details are intentionally excluded.",
    "TTL behavior is asynchronous by design; deletion timing is not guaranteed instantly."
  ]
}
